{
  "formatVersion": 1,
  "role": "derived-specops-catalog-projection",
  "authorityRule": "Owning sources control meaning; this index does not grant semantic authority.",
  "nodes": [
    {
      "id": "entif:development-substrate",
      "kind": "architecture",
      "title": "Development substrate",
      "status": "in-development",
      "owner": "Entif maintainers",
      "source": {
        "path": "specs/architecture.md",
        "sha256": "624c6e44fa65b1539ce7a66936e2dcb833344bb7e11dd8f7dcef45494d3cc5d7"
      }
    },
    {
      "id": "rosetta:behavioral-compatibility-v1",
      "kind": "behavior",
      "title": "Bounded behavioral compatibility (proposed v1)",
      "status": "in-development",
      "owner": "Rosetta interoperability/compatibility maintainers",
      "source": {
        "path": "specs/behavioral-compatibility-v1.md",
        "sha256": "9ffbe0fa33b76d5aa400dee2faa6e77b3f95b3d11af27156465072ab63954477"
      }
    },
    {
      "id": "entif:substrate-principles",
      "kind": "principles",
      "title": "Substrate principles",
      "status": "in-development",
      "owner": "Entif maintainers",
      "source": {
        "path": "specs/principles.md",
        "sha256": "cad4ce7f4f9c492b1c8276d2f940a868536206dbaa06372a93d400ded299a89e"
      }
    },
    {
      "id": "entif:akasha-falkor-closeout",
      "kind": "plan",
      "title": "Reconcile the forward Akasha V0 backend path",
      "status": "in-progress",
      "task": "T1738",
      "issues": [1738, 1734, 1664, 1667, 1668, 1669],
      "pr": 1732,
      "source": {
        "path": "plans/akasha-falkor-closeout.md",
        "sha256": "7aeb8f50584947b894c40c086a49c9438f419f0121808ce81104d412ccae3f34"
      }
    },
    {
      "id": "entif:akasha-v0-acceptance",
      "kind": "plan",
      "title": "Close the integrated Akasha V0 proving slice",
      "status": "planned",
      "task": "T1664",
      "issues": [1664],
      "pr": 1732,
      "source": {
        "path": "plans/akasha-v0-acceptance.md",
        "sha256": "a1956289fa86ff430c1dfea89b71a5b72ac9f1634addbd73e79b2bb25e01ef66"
      }
    },
    {
      "id": "entif:axi-base",
      "kind": "plan",
      "title": "axi-base",
      "status": "done",
      "task": "T1712",
      "issues": [1712],
      "pr": 1723,
      "source": {
        "path": "plans/axi-base.md",
        "sha256": "dd4a2918c7b2d8b58bd0905b74db10533fa6d89c2dd10a4da794b2ce3828b1a7"
      }
    },
    {
      "id": "entif:axi-github",
      "kind": "plan",
      "title": "axi-github",
      "status": "done",
      "task": "T1714",
      "issues": [1714],
      "pr": 1723,
      "source": {
        "path": "plans/axi-github.md",
        "sha256": "18ae078890d6bd12cfc7280c9f29f2c361dc456efcc5936f85027fa76cfdd037"
      }
    },
    {
      "id": "entif:axi-npm",
      "kind": "plan",
      "title": "axi-npm",
      "status": "done",
      "task": "T1715",
      "issues": [1715],
      "pr": 1723,
      "source": {
        "path": "plans/axi-npm.md",
        "sha256": "bbc65a2516e9bc35aba224bc58ed8ff84b9ad90d549dc4ca22663e40295af3f8"
      }
    },
    {
      "id": "entif:axi-quota",
      "kind": "plan",
      "title": "axi-quota",
      "status": "done",
      "task": "T1713",
      "issues": [1713],
      "pr": 1723,
      "source": {
        "path": "plans/axi-quota.md",
        "sha256": "f8cdf9de55208416771a2a34cfa9deb2e058731213851c439881eec0885c6285"
      }
    },
    {
      "id": "entif:badger-experiment",
      "kind": "plan",
      "title": "badger-experiment",
      "status": "planned",
      "task": "T1711",
      "issues": [1711],
      "pr": null,
      "source": {
        "path": "plans/badger-experiment.md",
        "sha256": "0ab74071d92422fafdd68dabf45f021d52991a87e4bad63c9de7b72bed96c947"
      }
    },
    {
      "id": "entif:behavioral-compatibility",
      "kind": "plan",
      "title": "Behavioral interoperability Profile and deterministic proof",
      "status": "in-progress",
      "task": "T1556",
      "issues": [1556, 1553],
      "pr": null,
      "source": {
        "path": "plans/behavioral-compatibility.md",
        "sha256": "d708f8017cd99140eda123d409629d033889a9d75e62ac95a4b3dce7a591735e"
      }
    },
    {
      "id": "entif:compiled-context",
      "kind": "plan",
      "title": "Public compiled-context output conformance",
      "status": "in-progress",
      "task": "T1729",
      "issues": [1729, 1488],
      "pr": 1732,
      "source": {
        "path": "plans/compiled-context.md",
        "sha256": "9ee8efce1a9eae04f9ee22022384cb2c76d907881e64553107918872dab35584"
      }
    },
    {
      "id": "entif:engineering-akasha",
      "kind": "plan",
      "title": "Reconstruct JCS engineering work through Akasha evidence",
      "status": "in-progress",
      "task": "T1726",
      "issues": [1726, 1693],
      "pr": 1732,
      "source": {
        "path": "plans/engineering-akasha.md",
        "sha256": "1c24f4b98f5ed58b5131fff4216dcbe2b3a024cba83ee4f789670bd16cf06ca4"
      }
    },
    {
      "id": "entif:graph-view",
      "kind": "plan",
      "title": "Bounded GraphView conformance",
      "status": "in-progress",
      "task": "T1728",
      "issues": [1728, 1671],
      "pr": 1732,
      "source": {
        "path": "plans/graph-view.md",
        "sha256": "970c40c58cc1579fac89c84c8b88b90404a7ad37221f349d5065a09345d3a873"
      }
    },
    {
      "id": "entif:impact-revalidation",
      "kind": "plan",
      "title": "Dependency impact and revalidation",
      "status": "in-progress",
      "task": "T1730",
      "issues": [1730],
      "pr": 1732,
      "source": {
        "path": "plans/impact-revalidation.md",
        "sha256": "725d8c1853add741aead7974aa5880e4bd12f54f21f3360575256556dd68e027"
      }
    },
    {
      "id": "entif:jcs-001",
      "kind": "plan",
      "title": "Repair RFC 8785 canonical JSON ordering and conformance vectors",
      "status": "done",
      "task": "T1693",
      "issues": [1693, 528],
      "pr": 1725,
      "source": {
        "path": "plans/jcs-001.md",
        "sha256": "a3f937702a9aba6d670a6a7fe1215559da608b51bc85ba276ffc035aa61a9e53"
      }
    },
    {
      "id": "entif:materialized-view",
      "kind": "plan",
      "title": "Materialized view identity, frontier and currency",
      "status": "in-progress",
      "task": "T1731",
      "issues": [1731, 1567],
      "pr": 1732,
      "source": {
        "path": "plans/materialized-view.md",
        "sha256": "9ebf249b4951c0b9223f2030b2b114f75c1d70042a4a70319dac9b427b29ab5f"
      }
    },
    {
      "id": "entif:run-completion",
      "kind": "plan",
      "title": "Terminal engineering-run completion evidence",
      "status": "in-progress",
      "task": "T1727",
      "issues": [1727],
      "pr": 1732,
      "source": {
        "path": "plans/run-completion.md",
        "sha256": "6e40c08ded8c9261066942db9050e9031d3e5fb9890afe8c70f8f0c693cf6213"
      }
    },
    {
      "id": "entif:salience-schema",
      "kind": "plan",
      "title": "Implement the public salience Profile/schema and conformance fixtures",
      "status": "done",
      "task": "T1694",
      "issues": [1694, 1670, 1558, 1567],
      "pr": 1697,
      "source": {
        "path": "plans/salience-schema.md",
        "sha256": "3323a112b61b5898f9251155fe73d2a006b8b88a50300bf7ca7c8912b18610bf"
      }
    },
    {
      "id": "entif:specops-context",
      "kind": "plan",
      "title": "specops-context",
      "status": "done",
      "task": "T1720",
      "issues": [1720],
      "pr": 1723,
      "source": {
        "path": "plans/specops-context.md",
        "sha256": "ca86945457f7e098a177a856884d1351148a4a9b5fe51b38c371fe5936897b50"
      }
    },
    {
      "id": "entif:specops-dist",
      "kind": "plan",
      "title": "specops-dist",
      "status": "done",
      "task": "T1721",
      "issues": [1721],
      "pr": 1723,
      "source": {
        "path": "plans/specops-dist.md",
        "sha256": "221ffd0f993f96a3a8f6b4cb78fe867afea2a6fbcc8ad836413995b373f1395e"
      }
    },
    {
      "id": "entif:specops-drift",
      "kind": "plan",
      "title": "specops-drift",
      "status": "done",
      "task": "T1719",
      "issues": [1719],
      "pr": 1723,
      "source": {
        "path": "plans/specops-drift.md",
        "sha256": "23d60d18f8c4283a340514bec2aaa7b21f608233bb623789cf4271dfab8ce3be"
      }
    },
    {
      "id": "entif:specops-integrated",
      "kind": "plan",
      "title": "specops-integrated",
      "status": "done",
      "task": "T1716",
      "issues": [1716],
      "pr": 1723,
      "source": {
        "path": "plans/specops-integrated.md",
        "sha256": "6a4645114492f01f008a17f0d561b1f2a78188aa5758aac87f4c484ac7eef2bb"
      }
    },
    {
      "id": "entif:specops-migrate",
      "kind": "plan",
      "title": "specops-migrate",
      "status": "done",
      "task": "T1717",
      "issues": [1717],
      "pr": 1723,
      "source": {
        "path": "plans/specops-migrate.md",
        "sha256": "440c38cb4671129a856a10672d349cc9e557adc71f3ed7006b3bcd2a29d3b8f3"
      }
    },
    {
      "id": "entif:specops-plans",
      "kind": "plan",
      "title": "specops-plans",
      "status": "done",
      "task": "T1718",
      "issues": [1718],
      "pr": 1723,
      "source": {
        "path": "plans/specops-plans.md",
        "sha256": "71a3ac5aab8fa4cc69da0d68d9fe4a17cfb415bdcbc4bc89644fb55cddb4101c"
      }
    },
    {
      "id": "entif:trace-graph-falkor",
      "kind": "plan",
      "title": "Re-prove the operational projection against FalkorDB",
      "status": "in-progress",
      "task": "T1735",
      "issues": [1735, 1734, 1664],
      "pr": 1732,
      "source": {
        "path": "plans/trace-graph-falkor.md",
        "sha256": "a3100c9ca8054b623890b187615bb3c0e419ed1b85b8a76bcd85084a4d68be5d"
      }
    },
    {
      "id": "entif:trace-graph",
      "kind": "plan",